AUTHOR;DATES / CENTURY;VIAF;TITLE;YEAR;PLACE;EDITOR;PUBLISHER / DEALER;LANGUAGE;other EDITIONS;KEY WORD 1; KEY WORDS 2;KEY WORDS 3;KEY WORDS 4;KEY WORDS 5;KEY WORDS Unite;LINKS;TOPIC OR SUBJECT 1;TOPIC OR SUBJECT 2;TOPIC OR SUBJECT 3
Veron, François;1575 - 1649;http://viaf.org/viaf/12317799;Conference entre le P. François Veron de la Compagnie de Iesus, et le Sieur de Langle M. de Queuilly, lez-Roüen, assisté de son Collegue le Sieur de la Riuiere. Sur le sacrifice de la messe Propitiatoire pour les Viuans & Trespassez;1619;Rouen;;Nicolas Le Prevost;French;;Mass;Eucharist;Jesuit;Catholic;;"Mass;Eucharist;Jesuit;Catholic;";https://books.google.it/books?id=gZCkmxUardQC&printsec=frontcover&hl=it&source=gbs_ge_summary_r&cad=0#v=onepage&q&f=false ;4. Sacrifice and Eucharist (16th-18th century);;
De Vio, Tommaso;1469 - 1534;http://viaf.org/viaf/49196005;Adversus Luteranos iuxta scripturam tractatus de sacrificio missae, de communione, de confessione, de sactisfactione, de invocatione sanctorum;1532;Cologne;;Quentel;Latin;;Catholic;Mess;Controversy;Mess;Sacrament;"Catholic;Mess;Controversy;Mess;Sacrament";https://daten.digitale-sammlungen.de/0003/bsb00035928/images/index.html?fip=193.174.98.30&id=00035928&seite=1;4. Sacrifice and Eucharist (16th-18th century);;
Viret, Pierre;1511 - 1571;http://viaf.org/viaf/32318;De la vraye et fausse religion : touchant les voeus et les sermens licites et illicites : et notamment touchant les voeus de perpetuelle continence et les voeus d'anatheme et d'execration et les sacrifices d'hosties humaines, et de l'excommunication en toutes religions;1560;[Geneva?];;Jean Rivery;French;;Calvinist;Discipline;Abstinence;Self-sacrifice;;"Calvinist;Discipline;Abstinence;Self-sacrifice;";https://books.google.ch/books?id=oVGgj00y17wC&printsec=frontcover&hl=it&source=gbs_ge_summary_r&cad=0#v=onepage&q&f=false ;4. Sacrifice and Eucharist (16th-18th century);;
Watts, Isaac;1674 - 1748;http://viaf.org/viaf/17298403;The Redeemer and the Sanctifier: or The sacrifice of Christ and the operations of the Spirit vindicated [&c. By I. Watts];1737;London;;J. Oswald;English;;Christ's sacrifice;Redemption;Controversy;Protestant;;"Christ's sacrifice;Redemption;Controversy;Protestant;";http://books.google.com/books/download/The_Redeemer_and_the_Sanctifier__or_The_.pdf?id=0rgCAAAAQAAJ&output=pdf&sig=ACfU3U2uDCCAZPND7-EyELz0se-TPPOoRA;4. Sacrifice and Eucharist (16th-18th century);;
Bunyan, John;1628 - 1688; http://viaf.org/viaf/71388170;The acceptable sacrifice, or, The excellency of a broken heart shewing the nature, signs and proper effects of a contrite spirit;1689;London;;Larkin George;English;;Mysticism;Puritan;Baptist;Individual Sacrifice;Individual Sacrifice;"Mysticism;Puritan;Baptist;Individual Sacrifice;Individual Sacrifice";https://www.worldcat.org/title/acceptable-sacrifice-or-the-excellency-of-a-broken-heart-shewing-the-nature-signs-and-proper-effects-of-a-contrite-spirit/oclc/12085612&referer=brief_results;6. Sacrifices of self: Martyrology after Reformation (16th-18th century);;
Caron, Claude;? - 1609;http://viaf.org/viaf/213069454;Response aux blasphèmes d'un ministre de Calvin sacramentaire semez dans ses escris contre le S. Sacrifice de l'autel;1590;Tournon;;n. p.;French;;Calvinism;Controversy;Sacraments;Lyturgical Books;Catholic;"Calvinism;Controversy;Sacraments;Lyturgical Books;Catholic";"https://books.google.it/books?id=9gs8AAAAcAAJ&pg=PA3&lpg=PA3&dq=R%C3%A9ponse+aux+blasph%C3%A8mes+d%27un+ministre+de+Calvin+sacramentaire+semez+dans+ses+escris+contre+le+S.+Sacrifice+de+l%27autel&source=bl&ots=i-CVh1W8td&sig=ACfU3U3BtQzzSxjqz1RFQTcoq1ZNm6E9Qg&hl=it&sa=X&ved=2ahUKEwi29ezw_qzwAhWLKewKHaVgCKwQ6AEwA3oECAEQAw#v=onepage&q=R%C3%A9ponse%20aux%20blasph%C3%A8mes%20d'un%20ministre%20de%20Calvin%20sacramentaire%20semez%20dans%20ses%20escris%20contre%20le%20S.%20Sacrifice%20de%20l'autel&f=false
";6. Sacrifices of self: Martyrology after Reformation (16th-18th century);;
Challoner, Richard;1691 - 1781;http://viaf.org/viaf/54166109;The Catholic Christian instructed in the sacraments, sacrifice, ceremonies, and observances of the church: By way of question and answer;1786;Philadelphia;;Talbot C.;English;;Handbooks;Catholic;Pedagogy;;;"Handbooks;Catholic;Pedagogy;;";https://books.googleusercontent.com/books/content?req=AKW5Qacuj-Ti9IQ6EVS3pvViUTaqhzIgC1XQ15E3liFm6wid8USLLNRt7eerGgHx1a1WhmdhphJjQqZPhdf6EMKHM_rHIyeJWnwr7xWfJc22QHP8x-v8essKz9QU6ZtxRbY6vBszRaNP_bGTPczPpYtXUQwo19rwdpWPywVXX3qU5DwJtwZWT1IMU1lsK23fQF4f6pHDkxjqJ3T77Bzv7Z9RmRVTo5c7CwdzWmRn50zA7sCRimI9Sva0A4mrwCAKHFVOHUGCWaVbk_-gKw9QdyvkcfOVyiEQxLMif_N4HUIY76PnpJgg0RI;6. Sacrifices of self: Martyrology after Reformation (16th-18th century);;
Roberts, Francis;1609 - 1675;http://viaf.org/viaf/12650271;A broken spirit, God's sacrifices. Or, The gratefulnesse of a broken spirit unto God. Represented in a sermon, before the right Honourable House of Peeres, in K. Henry the Seventh's chappell in the Abbey Westminster, upon Wednesday Decemb. 9. 1646. Being a day of publike humiliation for removing of the great judgment of rain and waters then upon the kingdome, &c;1646;London;;George Calvert;English;;Sermon;Anglican;Sin;;;"Sermon;Anglican;Sin;;";"https://quod.lib.umich.edu/e/eebo/A91855.0001.001/1:3?rgn=div1;view=fulltext";6. Sacrifices of self: Martyrology after Reformation (16th-18th century);;
Sibbes, Richard;1577 - 1635;http://viaf.org/viaf/32139543;Evangelicall sacrifices. In xix. sermons. I. Thankfull commemorations for Gods mercy in our great deliverance from the papists powder-plot. 2. The successefull seeker. 3. Faith triumphant. 4. Speciall preparations to fit us for our latter end in foure funerall sermons. 5. The faithfull covenanter. 6. The demand of a good conscience. 7. The sword of the wicked. By the late learned and reverend divine, Rich. Sibbs. Doctor in Divinity, Mr. of Katherine Hall in Cambridge, and sometimes preacher to the honourable society of Grayes-Inne. The third tome. Published and perused by D. Sibbs owne appointment, subscribed with his hand to prevent imperfect copies after his decease;1640;London;;T. B. ;English;John William, Lonfon, 1645;Sermon;Anglican;Christ's sacrifice;Controversy;;"Sermon;Anglican;Christ's sacrifice;Controversy;";https://ota.bodleian.ox.ac.uk/repository/xmlui/handle/20.500.12024/A12182;6. Sacrifices of self: Martyrology after Reformation (16th-18th century);;
Laurence, Roger;1670 - 1636;http://viaf.org/viaf/71741897;"The Bishop of Oxford's charge consider'd, in reference to the independency of the church upon the state, a proper sacrifice in the sacrament of the Lord's supper, the nature and necessity of sacerdotal absolution, and the invalidity of baptism, administered by persons not episcopally ordain'd.
";1712;London;;H. Clements;English;;Anglican treatise about Jesus' sacrifice and the supremacy of the Church on the Statee;;;;;"Anglican treatise about Jesus' sacrifice and the supremacy of the Church on the Statee;;;;";https://www.google.it/books/edition/The_Bishop_of_Oxford_s_Charge_Consider_d/s-NbAAAAQAAJ?hl=it&gbpv=1&dq=The+Bishop+of+Oxford%27s+charge+consider%27d&printsec=frontcover ;;;
